[
  {
    "id": "shijing_guofeng_zhounan_linzhizhi_s001",
    "篇目": {
      "书": "诗经",
      "卷": "国风",
      "篇": "麟之趾",
      "序号": 1
    },
    "校勘文": "麟之趾，振振公子，于嗟麟兮。",
    "今译": "",
    "注音": "",
    "注释": [
      {
        "id": "n001",
        "anchor": "麟之趾振振公子于嗟麟兮",
        "粒度": "句",
        "注释类型": "训诂",
        "内容": "兴也。",
        "文献id": "src001"
      },
      {
        "id": "n002",
        "anchor": "趾",
        "粒度": "字",
        "注释类型": "训诂",
        "内容": "趾，足也。",
        "文献id": "src001"
      },
      {
        "id": "n003",
        "anchor": "麟",
        "粒度": "字",
        "注释类型": "训诂",
        "内容": "麟信而应礼，以足至者也。",
        "span": [
          0,
          1
        ],
        "文献id": "src001"
      },
      {
        "id": "n004",
        "anchor": "振振",
        "粒度": "词",
        "注释类型": "训诂",
        "内容": "振振，信厚也。",
        "文献id": "src001"
      },
      {
        "id": "n005",
        "anchor": "麟之趾振振公子于嗟麟兮",
        "粒度": "句",
        "注释类型": "笺注",
        "内容": "兴者，喻今公子亦信厚，与礼相应，有似于麟。",
        "文献id": "src001"
      },
      {
        "id": "n006",
        "anchor": "振",
        "粒度": "字",
        "注释类型": "音韵",
        "内容": "振，音真。",
        "span": [
          3,
          4
        ],
        "文献id": "src001"
      },
      {
        "id": "n007",
        "anchor": "于嗟",
        "粒度": "词",
        "注释类型": "训诂",
        "内容": "于嗟，叹辞。",
        "文献id": "src001"
      }
    ]
  },
  {
    "id": "shijing_guofeng_zhounan_linzhizhi_s002",
    "篇目": {
      "书": "诗经",
      "卷": "国风",
      "篇": "麟之趾",
      "序号": 2
    },
    "校勘文": "麟之角，振振公姓，于嗟麟兮。",
    "今译": "",
    "注音": "",
    "注释": [
      {
        "id": "n001",
        "anchor": "角",
        "粒度": "字",
        "注释类型": "训诂",
        "内容": "麟角，所以表其德也。",
        "文献id": "src001"
      },
      {
        "id": "n002",
        "anchor": "角",
        "粒度": "字",
        "注释类型": "笺注",
        "内容": "麟角之末有肉，示有武而不用。",
        "文献id": "src001"
      },
      {
        "id": "n003",
        "anchor": "于嗟",
        "粒度": "词",
        "注释类型": "训诂",
        "内容": "于嗟，叹辞。",
        "文献id": "src001"
      }
    ]
  },
  {
    "id": "shijing_guofeng_zhounan_linzhizhi_s003",
    "篇目": {
      "书": "诗经",
      "卷": "国风",
      "篇": "麟之趾",
      "序号": 3
    },
    "校勘文": "麟之定，振振公族，于嗟麟兮。",
    "今译": "",
    "注音": "",
    "注释": [
      {
        "id": "n001",
        "anchor": "定",
        "粒度": "字",
        "注释类型": "训诂",
        "内容": "定，题也。",
        "文献id": "src001"
      },
      {
        "id": "n002",
        "anchor": "定",
        "粒度": "字",
        "注释类型": "音韵",
        "内容": "定，都佞反",
        "文献id": "src001"
      },
      {
        "id": "n003",
        "anchor": "定",
        "粒度": "字",
        "注释类型": "校勘",
        "内容": "字书作「顁」，音同",
        "文献id": "src001"
      },
      {
        "id": "n004",
        "anchor": "定",
        "粒度": "字",
        "注释类型": "校勘",
        "内容": "本作「颠」，误",
        "文献id": "src001"
      },
      {
        "id": "n005",
        "anchor": "于嗟",
        "粒度": "词",
        "注释类型": "训诂",
        "内容": "于嗟，叹辞。",
        "文献id": "src001"
      }
    ]
  }
]