[
  {
    "id": "shi_feng_zhounan_guanju-s001",
    "篇目": {
      "书": "诗经",
      "卷": "国风",
      "篇": "关雎",
      "序号": 1
    },
    "校勘文": "关关雎鸠，在河之洲。",
    "注释": []
  },
  {
    "id": "shi_feng_zhounan_guanju-s002",
    "篇目": {
      "书": "诗经",
      "卷": "国风",
      "篇": "关雎",
      "序号": 2
    },
    "校勘文": "窈窕淑女，君子好逑。",
    "注释": []
  },
  {
    "id": "shi_feng_zhounan_guanju-s003",
    "篇目": {
      "书": "诗经",
      "卷": "国风",
      "篇": "关雎",
      "序号": 3
    },
    "校勘文": "参差荇菜，左右流之。",
    "注释": []
  },
  {
    "id": "shi_feng_zhounan_guanju-s004",
    "篇目": {
      "书": "诗经",
      "卷": "国风",
      "篇": "关雎",
      "序号": 4
    },
    "校勘文": "窈窕淑女，寤寐求之。",
    "注释": []
  },
  {
    "id": "shi_feng_zhounan_guanju-s005",
    "篇目": {
      "书": "诗经",
      "卷": "国风",
      "篇": "关雎",
      "序号": 5
    },
    "校勘文": "求之不得，寤寐思服。",
    "注释": []
  },
  {
    "id": "shi_feng_zhounan_guanju-s006",
    "篇目": {
      "书": "诗经",
      "卷": "国风",
      "篇": "关雎",
      "序号": 6
    },
    "校勘文": "悠哉悠哉，辗转反侧。",
    "注释": []
  },
  {
    "id": "shi_feng_zhounan_guanju-s007",
    "篇目": {
      "书": "诗经",
      "卷": "国风",
      "篇": "关雎",
      "序号": 7
    },
    "校勘文": "参差荇菜，左右采之。",
    "注释": []
  },
  {
    "id": "shi_feng_zhounan_guanju-s008",
    "篇目": {
      "书": "诗经",
      "卷": "国风",
      "篇": "关雎",
      "序号": 8
    },
    "校勘文": "窈窕淑女，琴瑟友之。",
    "注释": []
  },
  {
    "id": "shi_feng_zhounan_guanju-s009",
    "篇目": {
      "书": "诗经",
      "卷": "国风",
      "篇": "关雎",
      "序号": 9
    },
    "校勘文": "参差荇菜，左右芼之。",
    "注释": []
  },
  {
    "id": "shi_feng_zhounan_guanju-s010",
    "篇目": {
      "书": "诗经",
      "卷": "国风",
      "篇": "关雎",
      "序号": 10
    },
    "校勘文": "窈窕淑女，钟鼓乐之。",
    "注释": []
  }
]