[
  {
    "id": "shijing_guofeng_zhounan_hanguang_s001",
    "篇目": {
      "书": "诗经",
      "卷": "国风",
      "篇": "汉广",
      "序号": 1
    },
    "校勘文": "南有乔木，不可休息。",
    "今译": "",
    "注音": "",
    "注释": [
      {
        "id": "n001",
        "anchor": "南有乔木，不可休息",
        "粒度": "句",
        "文献id": "src001",
        "注释类型": "训诂",
        "内容": "南方之木，美乔上竦也。"
      }
    ]
  },
  {
    "id": "shijing_guofeng_zhounan_hanguang_s002",
    "篇目": {
      "书": "诗经",
      "卷": "国风",
      "篇": "汉广",
      "序号": 2
    },
    "校勘文": "汉有游女，不可求思。",
    "今译": "",
    "注音": "",
    "注释": [
      {
        "id": "n001",
        "anchor": "汉有游女不可求思",
        "粒度": "句",
        "注释类型": "训诂",
        "内容": "兴也。",
        "文献id": "src001"
      },
      {
        "id": "n002",
        "anchor": "思",
        "粒度": "字",
        "注释类型": "训诂",
        "内容": "思，辞也。",
        "文献id": "src001"
      },
      {
        "id": "n003",
        "anchor": "游女",
        "粒度": "词",
        "注释类型": "训诂",
        "内容": "汉上游女",
        "文献id": "src001"
      },
      {
        "id": "n004",
        "anchor": "汉有游女不可求思",
        "粒度": "句",
        "注释类型": "句义",
        "内容": "汉上游女，无求思者。",
        "文献id": "src001"
      },
      {
        "id": "n005",
        "anchor": "不可",
        "粒度": "词",
        "注释类型": "笺注",
        "内容": "不可者，本有可道也。",
        "文献id": "src001"
      },
      {
        "id": "n006",
        "anchor": "汉有游女不可求思",
        "粒度": "句",
        "注释类型": "笺注",
        "内容": "兴者，喻贤女虽出游流水之上，人无欲求犯礼者，亦由贞洁使之然。",
        "文献id": "src001"
      },
      {
        "id": "n007",
        "anchor": "汉",
        "粒度": "字",
        "注释类型": "校勘",
        "内容": "「流水」，本或作「汉水」。",
        "文献id": "src001"
      }
    ]
  },
  {
    "id": "shijing_guofeng_zhounan_hanguang_s003",
    "篇目": {
      "书": "诗经",
      "卷": "国风",
      "篇": "汉广",
      "序号": 3
    },
    "校勘文": "江之永矣，不可方思。",
    "今译": "",
    "注音": "",
    "注释": [
      {
        "id": "n001",
        "anchor": "永",
        "粒度": "字",
        "注释类型": "训诂",
        "内容": "永，长。",
        "文献id": "src001"
      },
      {
        "id": "n002",
        "anchor": "方",
        "粒度": "字",
        "注释类型": "训诂",
        "内容": "方，泭也。",
        "文献id": "src001"
      },
      {
        "id": "n003",
        "anchor": "江",
        "粒度": "字",
        "注释类型": "训诂",
        "内容": "江也",
        "文献id": "src001"
      },
      {
        "id": "n004",
        "anchor": "不可",
        "粒度": "词",
        "注释类型": "笺注",
        "内容": "今以广长之故，故不可也。",
        "文献id": "src001"
      },
      {
        "id": "n005",
        "anchor": "江之永矣不可方思",
        "粒度": "句",
        "注释类型": "笺注",
        "内容": "又喻女之贞洁，犯礼而往，将不至也。",
        "文献id": "src001"
      }
    ]
  },
  {
    "id": "shijing_guofeng_zhounan_hanguang_s004",
    "篇目": {
      "书": "诗经",
      "卷": "国风",
      "篇": "汉广",
      "序号": 4
    },
    "校勘文": "汉之广矣，不可泳思。",
    "今译": "",
    "注音": "",
    "注释": [
      {
        "id": "n001",
        "anchor": "泳",
        "粒度": "字",
        "注释类型": "训诂",
        "内容": "潜行为泳。",
        "文献id": "src001"
      },
      {
        "id": "n002",
        "anchor": "泳",
        "粒度": "字",
        "注释类型": "音韵",
        "内容": "泳音咏。",
        "文献id": "src001"
      },
      {
        "id": "n003",
        "anchor": "汉",
        "粒度": "字",
        "注释类型": "训诂",
        "内容": "汉也",
        "文献id": "src001"
      },
      {
        "id": "n004",
        "anchor": "不可",
        "粒度": "词",
        "注释类型": "笺注",
        "内容": "今以广长之故，故不可也。",
        "文献id": "src001"
      },
      {
        "id": "n005",
        "anchor": "汉之广矣不可泳思",
        "粒度": "句",
        "注释类型": "笺注",
        "内容": "又喻女之贞洁，犯礼而往，将不至也。",
        "文献id": "src001"
      }
    ]
  },
  {
    "id": "shijing_guofeng_zhounan_hanguang_s005",
    "篇目": {
      "书": "诗经",
      "卷": "国风",
      "篇": "汉广",
      "序号": 5
    },
    "校勘文": "翘翘错薪，言刈其楚。",
    "今译": "",
    "注音": "",
    "注释": [
      {
        "id": "n001",
        "anchor": "翘翘",
        "粒度": "词",
        "注释类型": "训诂",
        "内容": "翘翘，薪貌。",
        "文献id": "src001"
      },
      {
        "id": "n002",
        "anchor": "错",
        "粒度": "字",
        "注释类型": "训诂",
        "内容": "错，杂也。",
        "文献id": "src001"
      },
      {
        "id": "n003",
        "anchor": "楚",
        "粒度": "字",
        "注释类型": "笺注",
        "内容": "楚，杂薪之中尤翘翘者。",
        "文献id": "src001"
      },
      {
        "id": "n004",
        "anchor": "翘翘错薪言刈其楚",
        "粒度": "句",
        "注释类型": "笺注",
        "内容": "我欲刈取之，以喻众女皆贞洁，我又欲取其尤高洁者。",
        "文献id": "src001"
      },
      {
        "id": "n005",
        "anchor": "翘",
        "粒度": "字",
        "注释类型": "音韵",
        "内容": "翘，祁遥反，沈其尧反。",
        "文献id": "src001"
      }
    ]
  },
  {
    "id": "shijing_guofeng_zhounan_hanguang_s006",
    "篇目": {
      "书": "诗经",
      "卷": "国风",
      "篇": "汉广",
      "序号": 6
    },
    "校勘文": "之子于归，言秣其马。",
    "今译": "",
    "注音": "",
    "注释": [
      {
        "id": "n001",
        "anchor": "秣",
        "粒度": "字",
        "注释类型": "训诂",
        "内容": "秣，养也。",
        "文献id": "src001"
      },
      {
        "id": "n002",
        "anchor": "马",
        "粒度": "字",
        "注释类型": "训诂",
        "内容": "六尺以上曰马。",
        "文献id": "src001"
      },
      {
        "id": "n003",
        "anchor": "之子",
        "粒度": "词",
        "注释类型": "训诂",
        "内容": "之子，是子也。",
        "文献id": "src001"
      },
      {
        "id": "n004",
        "anchor": "之子于归言秣其马",
        "粒度": "句",
        "注释类型": "笺注",
        "内容": "谦不敢斥其适己，于是子之嫁，我原秣其马，致礼饩，示有意焉。",
        "文献id": "src001"
      },
      {
        "id": "n005",
        "anchor": "秣",
        "粒度": "字",
        "注释类型": "音韵",
        "内容": "秣，莫葛反。",
        "文献id": "src001"
      }
    ]
  },
  {
    "id": "shijing_guofeng_zhounan_hanguang_s007",
    "篇目": {
      "书": "诗经",
      "卷": "国风",
      "篇": "汉广",
      "序号": 7
    },
    "校勘文": "汉之广矣，不可泳思。",
    "今译": "",
    "注音": "",
    "注释": [
      {
        "id": "n001",
        "anchor": "泳",
        "粒度": "字",
        "注释类型": "训诂",
        "内容": "潜行为泳。",
        "文献id": "src001"
      },
      {
        "id": "n002",
        "anchor": "泳",
        "粒度": "字",
        "注释类型": "音韵",
        "内容": "泳音咏。",
        "文献id": "src001"
      },
      {
        "id": "n003",
        "anchor": "汉",
        "粒度": "字",
        "注释类型": "训诂",
        "内容": "汉也",
        "文献id": "src001"
      },
      {
        "id": "n004",
        "anchor": "不可",
        "粒度": "词",
        "注释类型": "笺注",
        "内容": "今以广长之故，故不可也。",
        "文献id": "src001"
      },
      {
        "id": "n005",
        "anchor": "汉之广矣不可泳思",
        "粒度": "句",
        "注释类型": "笺注",
        "内容": "又喻女之贞洁，犯礼而往，将不至也。",
        "文献id": "src001"
      }
    ]
  },
  {
    "id": "shijing_guofeng_zhounan_hanguang_s008",
    "篇目": {
      "书": "诗经",
      "卷": "国风",
      "篇": "汉广",
      "序号": 8
    },
    "校勘文": "江之永矣，不可方思。",
    "今译": "",
    "注音": "",
    "注释": [
      {
        "id": "n001",
        "anchor": "永",
        "粒度": "字",
        "注释类型": "训诂",
        "内容": "永，长。",
        "文献id": "src001"
      },
      {
        "id": "n002",
        "anchor": "方",
        "粒度": "字",
        "注释类型": "训诂",
        "内容": "方，泭也。",
        "文献id": "src001"
      },
      {
        "id": "n003",
        "anchor": "江",
        "粒度": "字",
        "注释类型": "笺注",
        "内容": "江也",
        "文献id": "src001"
      },
      {
        "id": "n004",
        "anchor": "不可",
        "粒度": "词",
        "注释类型": "笺注",
        "内容": "今以广长之故，故不可也。",
        "文献id": "src001"
      },
      {
        "id": "n005",
        "anchor": "江之永矣不可方思",
        "粒度": "句",
        "注释类型": "笺注",
        "内容": "又喻女之贞洁，犯礼而往，将不至也。",
        "文献id": "src001"
      }
    ]
  },
  {
    "id": "shijing_guofeng_zhounan_hanguang_s009",
    "篇目": {
      "书": "诗经",
      "卷": "国风",
      "篇": "汉广",
      "序号": 9
    },
    "校勘文": "翘翘错薪，言刈其蒌；",
    "今译": "",
    "注音": "",
    "注释": [
      {
        "id": "n001",
        "anchor": "蒌",
        "粒度": "字",
        "注释类型": "训诂",
        "内容": "蒌，草中之翘翘然。",
        "文献id": "src001"
      },
      {
        "id": "n002",
        "anchor": "蒌",
        "粒度": "字",
        "注释类型": "音韵",
        "内容": "蒌，力俱反。音力侯反。",
        "文献id": "src001"
      },
      {
        "id": "n003",
        "anchor": "蒌",
        "粒度": "字",
        "注释类型": "考证",
        "内容": "马云：「蒌，蒿也。」郭云：「似艾。」",
        "文献id": "src001"
      }
    ]
  },
  {
    "id": "shijing_guofeng_zhounan_hanguang_s010",
    "篇目": {
      "书": "诗经",
      "卷": "国风",
      "篇": "汉广",
      "序号": 10
    },
    "校勘文": "之子于归，言秣其驹。",
    "今译": "",
    "注音": "",
    "注释": [
      {
        "id": "n001",
        "anchor": "驹",
        "粒度": "字",
        "注释类型": "训诂",
        "内容": "五尺以上曰驹。",
        "文献id": "src001"
      }
    ]
  },
  {
    "id": "shijing_guofeng_zhounan_hanguang_s011",
    "篇目": {
      "书": "诗经",
      "卷": "国风",
      "篇": "汉广",
      "序号": 11
    },
    "校勘文": "汉之广矣，不可泳思；",
    "今译": "",
    "注音": "",
    "注释": []
  },
  {
    "id": "shijing_guofeng_zhounan_hanguang_s012",
    "篇目": {
      "书": "诗经",
      "卷": "国风",
      "篇": "汉广",
      "序号": 12
    },
    "校勘文": "江之永矣，不可方思。",
    "今译": "",
    "注音": "",
    "注释": [
      {
        "id": "n001",
        "anchor": "永",
        "粒度": "字",
        "注释类型": "训诂",
        "内容": "永，长。",
        "文献id": "src001"
      },
      {
        "id": "n002",
        "anchor": "方",
        "粒度": "字",
        "注释类型": "训诂",
        "内容": "方，泭也。",
        "文献id": "src001"
      },
      {
        "id": "n003",
        "anchor": "江",
        "粒度": "字",
        "注释类型": "训诂",
        "内容": "江也",
        "文献id": "src001"
      },
      {
        "id": "n004",
        "anchor": "不可",
        "粒度": "词",
        "注释类型": "笺注",
        "内容": "今以广长之故，故不可也。",
        "文献id": "src001"
      },
      {
        "id": "n005",
        "anchor": "江之永矣不可方思",
        "粒度": "句",
        "注释类型": "笺注",
        "内容": "又喻女之贞洁，犯礼而往，将不至也。",
        "文献id": "src001"
      }
    ]
  }
]