[
  {
    "id": "shijing_guofeng_zhounan_taoyao_s001",
    "篇目": {
      "书": "诗经",
      "卷": "国风",
      "篇": "桃夭",
      "序号": 1
    },
    "校勘文": "桃之夭夭，灼灼其华。",
    "今译": "",
    "注音": "",
    "注释": [
      {
        "anchor": "桃之夭夭灼灼其华",
        "id": "n001",
        "内容": "兴也。",
        "文献id": "src001",
        "注释类型": "训诂",
        "粒度": "句"
      },
      {
        "anchor": "桃",
        "id": "n002",
        "内容": "桃有华之盛者。",
        "文献id": "src001",
        "注释类型": "训诂",
        "粒度": "字"
      },
      {
        "anchor": "夭夭",
        "id": "n003",
        "内容": "夭夭，其少壮也。",
        "文献id": "src001",
        "注释类型": "训诂",
        "粒度": "词"
      },
      {
        "anchor": "灼灼",
        "id": "n004",
        "内容": "灼灼，华之盛也。",
        "文献id": "src001",
        "注释类型": "训诂",
        "粒度": "词"
      },
      {
        "anchor": "桃之夭夭灼灼其华",
        "id": "n005",
        "内容": "兴者，逾时妇人皆得以年盛时行也。",
        "文献id": "src001",
        "注释类型": "笺注",
        "粒度": "句"
      }
    ]
  },
  {
    "id": "shijing_guofeng_zhounan_taoyao_s002",
    "篇目": {
      "书": "诗经",
      "卷": "国风",
      "篇": "桃夭",
      "序号": 2
    },
    "校勘文": "之子于归，宜其室家。",
    "今译": "",
    "注音": "",
    "注释": [
      {
        "anchor": "之子",
        "id": "n001",
        "内容": "之子，嫁子也。",
        "文献id": "src001",
        "注释类型": "训诂",
        "粒度": "词"
      },
      {
        "anchor": "于",
        "id": "n002",
        "内容": "于，往也。",
        "文献id": "src001",
        "注释类型": "训诂",
        "粒度": "字"
      },
      {
        "anchor": "宜",
        "id": "n003",
        "内容": "宜，以有室家无逾时者。",
        "文献id": "src001",
        "注释类型": "训诂",
        "粒度": "字"
      },
      {
        "anchor": "宜",
        "id": "n004",
        "内容": "宜者，谓男女年时俱当。",
        "文献id": "src001",
        "注释类型": "笺注",
        "粒度": "字"
      }
    ]
  },
  {
    "id": "shijing_guofeng_zhounan_taoyao_s003",
    "篇目": {
      "书": "诗经",
      "卷": "国风",
      "篇": "桃夭",
      "序号": 3
    },
    "校勘文": "桃之夭夭，有蕡其实。",
    "今译": "",
    "注音": "",
    "注释": [
      {
        "anchor": "蕡",
        "id": "n001",
        "内容": "蕡，实貌。",
        "文献id": "src001",
        "注释类型": "训诂",
        "粒度": "字"
      },
      {
        "anchor": "桃之夭夭有蕡其实",
        "id": "n002",
        "内容": "非但有华色，又有妇德。",
        "文献id": "src001",
        "注释类型": "句义",
        "粒度": "句"
      },
      {
        "anchor": "蕡",
        "id": "n003",
        "内容": "蕡，浮云反。",
        "文献id": "src001",
        "注释类型": "音韵",
        "粒度": "字"
      }
    ]
  },
  {
    "id": "shijing_guofeng_zhounan_taoyao_s004",
    "篇目": {
      "书": "诗经",
      "卷": "国风",
      "篇": "桃夭",
      "序号": 4
    },
    "校勘文": "之子于归，宜其家室。",
    "今译": "",
    "注音": "",
    "注释": [
      {
        "anchor": "家室",
        "id": "n001",
        "内容": "家室，犹室家也。",
        "文献id": "src001",
        "注释类型": "训诂",
        "粒度": "词"
      }
    ]
  },
  {
    "id": "shijing_guofeng_zhounan_taoyao_s005",
    "篇目": {
      "书": "诗经",
      "卷": "国风",
      "篇": "桃夭",
      "序号": 5
    },
    "校勘文": "桃之夭夭，其叶蓁蓁。",
    "今译": "",
    "注音": "",
    "注释": [
      {
        "anchor": "蓁蓁",
        "id": "n001",
        "内容": "蓁蓁，至盛貌。",
        "文献id": "src001",
        "注释类型": "训诂",
        "粒度": "词"
      },
      {
        "anchor": "桃之夭夭其叶蓁蓁",
        "id": "n002",
        "内容": "有色有德，形体至盛也。",
        "文献id": "src001",
        "注释类型": "句义",
        "粒度": "句"
      },
      {
        "anchor": "蓁",
        "id": "n003",
        "内容": "蓁，侧巾反。",
        "文献id": "src001",
        "注释类型": "音韵",
        "粒度": "字"
      }
    ]
  },
  {
    "id": "shijing_guofeng_zhounan_taoyao_s006",
    "篇目": {
      "书": "诗经",
      "卷": "国风",
      "篇": "桃夭",
      "序号": 6
    },
    "校勘文": "之子于归，宜其家人。",
    "今译": "",
    "注音": "",
    "注释": [
      {
        "anchor": "之子于归宜其家人",
        "id": "n001",
        "内容": "一家之人尽以为宜。",
        "文献id": "src001",
        "注释类型": "句义",
        "粒度": "句"
      },
      {
        "anchor": "家人",
        "id": "n002",
        "内容": "家人，犹室家也。",
        "文献id": "src001",
        "注释类型": "笺注",
        "粒度": "词"
      }
    ]
  }
]