[
  {
    "id": "shijing_guofeng_shaonan_biaoyoumei_s001",
    "今译": "",
    "校勘文": "摽有梅，其实七兮。",
    "注释": [
      {
        "id": "n001",
        "anchor": "摽有梅其实七兮",
        "粒度": "句",
        "注释类型": "训诂",
        "内容": "兴也。",
        "文献id": "src001"
      },
      {
        "id": "n002",
        "anchor": "摽",
        "粒度": "字",
        "注释类型": "训诂",
        "内容": "摽，落也。",
        "文献id": "src001"
      },
      {
        "id": "n003",
        "anchor": "摽有梅其实七兮",
        "粒度": "句",
        "注释类型": "句义",
        "内容": "盛极则隋落者，梅也。尚在树者七。",
        "文献id": "src001"
      },
      {
        "id": "n004",
        "anchor": "摽有梅其实七兮",
        "粒度": "句",
        "注释类型": "句义",
        "内容": "兴者，梅实尚馀七未落，喻始衰也。谓女二十，春盛而不嫁，至夏则衰。",
        "文献id": "src001"
      }
    ],
    "注音": "",
    "篇目": {
      "书": "诗经",
      "卷": "国风",
      "序号": 1,
      "篇": "摽有梅"
    }
  },
  {
    "id": "shijing_guofeng_shaonan_biaoyoumei_s002",
    "今译": "",
    "校勘文": "求我庶士，迨其吉兮。",
    "注释": [
      {
        "id": "n001",
        "anchor": "吉",
        "粒度": "字",
        "注释类型": "训诂",
        "内容": "吉，善也。",
        "文献id": "src001"
      },
      {
        "id": "n002",
        "anchor": "我",
        "粒度": "字",
        "注释类型": "笺注",
        "内容": "我，我当嫁者。",
        "文献id": "src001"
      },
      {
        "id": "n003",
        "anchor": "庶",
        "粒度": "字",
        "注释类型": "训诂",
        "内容": "庶，众。",
        "文献id": "src001"
      },
      {
        "id": "n004",
        "anchor": "迨",
        "粒度": "字",
        "注释类型": "训诂",
        "内容": "迨，及也。",
        "文献id": "src001"
      },
      {
        "id": "n005",
        "anchor": "求我庶士迨其吉兮",
        "粒度": "句",
        "注释类型": "句义",
        "内容": "求女之当嫁者之众士，宜及其善时。善时谓年二十，虽夏未大衰。",
        "文献id": "src001"
      },
      {
        "id": "n006",
        "anchor": "迨",
        "粒度": "字",
        "注释类型": "音韵",
        "内容": "迨音待",
        "文献id": "src001"
      },
      {
        "id": "n007",
        "anchor": "迨",
        "粒度": "字",
        "注释类型": "考证",
        "内容": "《韩诗》云：「顾也。」",
        "文献id": "src001"
      }
    ],
    "注音": "",
    "篇目": {
      "书": "诗经",
      "卷": "国风",
      "序号": 1,
      "篇": "摽有梅"
    }
  },
  {
    "id": "shijing_guofeng_shaonan_biaoyoumei_s003",
    "今译": "",
    "校勘文": "摽有梅，其实三兮。",
    "注释": [
      {
        "id": "n001",
        "anchor": "摽有梅其实三兮",
        "粒度": "句",
        "注释类型": "句义",
        "内容": "在者三也。",
        "文献id": "src001"
      },
      {
        "id": "n002",
        "anchor": "摽有梅其实三兮",
        "粒度": "句",
        "注释类型": "笺注",
        "内容": "此夏乡晚，梅之隋落差多，在者馀三耳。",
        "文献id": "src001"
      }
    ],
    "注音": "",
    "篇目": {
      "书": "诗经",
      "卷": "国风",
      "序号": 1,
      "篇": "摽有梅"
    }
  },
  {
    "id": "shijing_guofeng_shaonan_biaoyoumei_s004",
    "今译": "",
    "校勘文": "求我庶士，迨其今兮。",
    "注释": [
      {
        "id": "n001",
        "anchor": "今",
        "粒度": "字",
        "注释类型": "训诂",
        "内容": "今，急辞也。",
        "文献id": "src001"
      }
    ],
    "注音": "",
    "篇目": {
      "书": "诗经",
      "卷": "国风",
      "序号": 1,
      "篇": "摽有梅"
    }
  },
  {
    "id": "shijing_guofeng_shaonan_biaoyoumei_s005",
    "今译": "",
    "校勘文": "摽有梅，顷筐塈之。",
    "注释": [
      {
        "id": "n001",
        "anchor": "塈",
        "粒度": "字",
        "注释类型": "训诂",
        "内容": "塈，取也。",
        "文献id": "src001"
      },
      {
        "id": "n002",
        "anchor": "摽有梅顷筐塈之",
        "粒度": "句",
        "注释类型": "句义",
        "内容": "顷筐取之，谓夏已晚，顷筐取之于地。",
        "文献id": "src001"
      },
      {
        "id": "n003",
        "anchor": "顷",
        "粒度": "字",
        "注释类型": "音韵",
        "内容": "顷音倾",
        "文献id": "src001"
      },
      {
        "id": "n004",
        "anchor": "塈",
        "粒度": "字",
        "注释类型": "音韵",
        "内容": "塈，许器反",
        "文献id": "src001"
      }
    ],
    "注音": "",
    "篇目": {
      "书": "诗经",
      "卷": "国风",
      "序号": 1,
      "篇": "摽有梅"
    }
  },
  {
    "id": "shijing_guofeng_shaonan_biaoyoumei_s006",
    "今译": "",
    "校勘文": "求我庶士，迨其谓之。",
    "注释": [
      {
        "id": "n001",
        "anchor": "求我庶士迨其谓之",
        "粒度": "句",
        "注释类型": "句义",
        "内容": "不待备礼也。三十之男，二十之女，礼未备则不待礼会而行之者，所以蕃育民人也。",
        "文献id": "src001"
      },
      {
        "id": "n002",
        "anchor": "谓",
        "粒度": "字",
        "注释类型": "笺注",
        "内容": "谓勤也。",
        "文献id": "src001"
      },
      {
        "id": "n003",
        "anchor": "求我庶士迨其谓之",
        "粒度": "句",
        "注释类型": "句义",
        "内容": "女年二十而无嫁端，则有勤望之忧。不待礼会而行之者，谓明年仲春，不待以礼会之也。时礼虽不备，相奔不禁。",
        "文献id": "src001"
      }
    ],
    "注音": "",
    "篇目": {
      "书": "诗经",
      "卷": "国风",
      "序号": 1,
      "篇": "摽有梅"
    }
  }
]