[
  {
    "id": "shijing_guofeng_zhounan_jiumu_s001",
    "篇目": {
      "书": "诗经",
      "卷": "国风",
      "篇": "樛木",
      "序号": 1
    },
    "校勘文": "南有樛木，葛藟累之。",
    "今译": "",
    "注音": "",
    "注释": [
      {
        "id": "n001",
        "anchor": "南有樛木，葛藟累之",
        "粒度": "句",
        "文献id": "src001",
        "注释类型": "训诂",
        "内容": "兴也。"
      },
      {
        "id": "n002",
        "anchor": "南",
        "粒度": "字",
        "文献id": "src001",
        "注释类型": "训诂",
        "内容": "南，南土也。"
      },
      {
        "id": "n003",
        "anchor": "樛",
        "粒度": "字",
        "文献id": "src001",
        "注释类型": "训诂",
        "内容": "木下曲曰樛。"
      },
      {
        "id": "n004",
        "anchor": "南有樛木，葛藟累之",
        "粒度": "句",
        "文献id": "src001",
        "注释类型": "句义",
        "内容": "南土之葛藟茂盛。"
      },
      {
        "id": "n005",
        "anchor": "南有樛木，葛藟累之",
        "粒度": "句",
        "文献id": "src001",
        "注释类型": "笺注",
        "内容": "木枝以下垂之故，故葛也藟也得累而蔓之，而上下俱盛。"
      },
      {
        "id": "n006",
        "anchor": "南有樛木，葛藟累之",
        "粒度": "句",
        "文献id": "src001",
        "注释类型": "笺注",
        "内容": "兴者，喻后妃能以意下逮众妾，使得其次序，则众妾上附事之，而礼义亦俱盛。"
      },
      {
        "id": "n007",
        "anchor": "南土",
        "粒度": "词",
        "文献id": "src001",
        "注释类型": "笺注",
        "内容": "南土谓荆、杨之域。"
      },
      {
        "id": "n008",
        "anchor": "藟",
        "粒度": "字",
        "文献id": "src001",
        "注释类型": "校勘",
        "内容": "本亦作「藟」。"
      },
      {
        "id": "n009",
        "anchor": "藟",
        "粒度": "字",
        "文献id": "src001",
        "注释类型": "音韵",
        "内容": "力轨反。"
      },
      {
        "id": "n010",
        "anchor": "藟",
        "粒度": "字",
        "文献id": "src001",
        "注释类型": "考证",
        "内容": "似葛之草。《草木疏》云：「一名巨荒，似燕薁，亦连蔓，叶似艾，白色，其子赤，可食。」"
      },
      {
        "id": "n011",
        "anchor": "累",
        "粒度": "字",
        "文献id": "src001",
        "注释类型": "音韵",
        "内容": "力追反，缠绕也。"
      },
      {
        "id": "n012",
        "anchor": "累",
        "粒度": "字",
        "文献id": "src001",
        "注释类型": "校勘",
        "内容": "木又作「累」。"
      },
      {
        "id": "n013",
        "anchor": "上附",
        "粒度": "词",
        "文献id": "src001",
        "注释类型": "音韵",
        "内容": "上附，时掌反。"
      }
    ]
  },
  {
    "id": "shijing_guofeng_zhounan_jiumu_s002",
    "篇目": {
      "书": "诗经",
      "卷": "国风",
      "篇": "樛木",
      "序号": 2
    },
    "校勘文": "乐只君子，福履绥之。",
    "今译": "",
    "注音": "",
    "注释": [
      {
        "id": "n001",
        "anchor": "履",
        "粒度": "字",
        "文献id": "src001",
        "注释类型": "训诂",
        "内容": "履，禄。"
      },
      {
        "id": "n002",
        "anchor": "绥",
        "粒度": "字",
        "文献id": "src001",
        "注释类型": "训诂",
        "内容": "绥，安也。"
      },
      {
        "id": "n003",
        "anchor": "乐只君子，福履绥之",
        "粒度": "句",
        "文献id": "src001",
        "注释类型": "句义",
        "内容": "妃妾以礼义相与和，又能以礼乐乐其君子，使为福禄所安。"
      },
      {
        "id": "n004",
        "anchor": "只",
        "粒度": "字",
        "文献id": "src001",
        "注释类型": "音韵",
        "内容": "只，之氏反，犹是也。"
      },
      {
        "id": "n005",
        "anchor": "绥之",
        "粒度": "词",
        "文献id": "src001",
        "注释类型": "音韵",
        "内容": "绥之音虽。"
      },
      {
        "id": "n006",
        "anchor": "乐",
        "粒度": "字",
        "文献id": "src001",
        "注释类型": "音韵",
        "内容": "乐乐，上音岳，下音洛。"
      }
    ]
  },
  {
    "id": "shijing_guofeng_zhounan_jiumu_s003",
    "篇目": {
      "书": "诗经",
      "卷": "国风",
      "篇": "樛木",
      "序号": 3
    },
    "校勘文": "南有樛木，葛藟荒之。",
    "今译": "",
    "注音": "",
    "注释": [
      {
        "id": "n001",
        "anchor": "荒",
        "粒度": "字",
        "文献id": "src001",
        "注释类型": "训诂",
        "内容": "荒，奄。"
      }
    ]
  },
  {
    "id": "shijing_guofeng_zhounan_jiumu_s004",
    "篇目": {
      "书": "诗经",
      "卷": "国风",
      "篇": "樛木",
      "序号": 4
    },
    "校勘文": "乐只君子，福履将之。",
    "今译": "",
    "注音": "",
    "注释": [
      {
        "id": "n001",
        "anchor": "将",
        "粒度": "字",
        "文献id": "src001",
        "注释类型": "训诂",
        "内容": "将，大也。"
      },
      {
        "id": "n002",
        "anchor": "乐只君子，福履将之",
        "粒度": "句",
        "文献id": "src001",
        "注释类型": "句义",
        "内容": "此章申殷勤之意。"
      },
      {
        "id": "n003",
        "anchor": "将",
        "粒度": "字",
        "文献id": "src001",
        "注释类型": "笺注",
        "内容": "将犹扶助也。"
      }
    ]
  },
  {
    "id": "shijing_guofeng_zhounan_jiumu_s005",
    "篇目": {
      "书": "诗经",
      "卷": "国风",
      "篇": "樛木",
      "序号": 5
    },
    "校勘文": "南有樛木，葛藟萦之。",
    "今译": "",
    "注音": "",
    "注释": [
      {
        "id": "n001",
        "anchor": "萦",
        "粒度": "字",
        "文献id": "src001",
        "注释类型": "训诂",
        "内容": "萦，旋也。"
      },
      {
        "id": "n002",
        "anchor": "萦",
        "粒度": "字",
        "文献id": "src001",
        "注释类型": "校勘",
        "内容": "本又作「萦」。"
      },
      {
        "id": "n003",
        "anchor": "萦",
        "粒度": "字",
        "文献id": "src001",
        "注释类型": "音韵",
        "内容": "乌营反。"
      },
      {
        "id": "n004",
        "anchor": "萦",
        "粒度": "字",
        "文献id": "src001",
        "注释类型": "校勘",
        "内容": "《说文》作「𡙻」。"
      }
    ]
  },
  {
    "id": "shijing_guofeng_zhounan_jiumu_s006",
    "篇目": {
      "书": "诗经",
      "卷": "国风",
      "篇": "樛木",
      "序号": 6
    },
    "校勘文": "乐只君子，福履成之。",
    "今译": "",
    "注音": "",
    "注释": [
      {
        "id": "n001",
        "anchor": "成",
        "粒度": "字",
        "文献id": "src001",
        "注释类型": "训诂",
        "内容": "成，就也。"
      }
    ]
  }
]